outputs/fusion/resnet_spai_cifake/history.json

{
  "history": [
    {
      "train_accuracy": 0.9618333333333333,
      "train_precision": 0.9601868869157016,
      "train_recall": 0.9636222222222223,
      "train_f1": 0.9619014873393152,
      "train_auc": 0.9935852061728395,
      "train_loss": 0.10072352861166001,
      "train_lr": 0.0001,
      "val_accuracy": 0.9786,
      "val_precision": 0.9732990506329114,
      "val_recall": 0.9842,
      "val_f1": 0.9787191726332538,
      "val_auc": 0.99783508,
      "val_loss": 0.05953359243869782,
      "epoch": 1,
      "best_score": 0.99783508,
      "best_epoch": 1
    },
    {
      "train_accuracy": 0.9806888888888889,
      "train_precision": 0.9803899795682687,
      "train_recall": 0.981,
      "train_f1": 0.9806948949215799,
      "train_auc": 0.998298821728395,
      "train_loss": 0.05147036720381843,
      "train_lr": 9.891830623632339e-05,
      "val_accuracy": 0.9787,
      "val_precision": 0.9757503478433711,
      "val_recall": 0.9818,
      "val_f1": 0.9787658259395873,
      "val_auc": 0.9975310199999999,
      "val_loss": 0.06371676721572876,
      "epoch": 2,
      "best_score": 0.99783508,
      "best_epoch": 1
    },
    {
      "train_accuracy": 0.9862555555555556,
      "train_precision": 0.9858344989897644,
      "train_recall": 0.9866888888888888,
      "train_f1": 0.9862615089016982,
      "train_auc": 0.999038504691358,
      "train_loss": 0.03782118151585261,
      "train_lr": 9.572050015330874e-05,
      "val_accuracy": 0.9819,
      "val_precision": 0.9839325165695922,
      "val_recall": 0.9798,
      "val_f1": 0.9818619100110232,
      "val_auc": 0.9985208,
      "val_loss": 0.04858948600292206,
      "epoch": 3,
      "best_score": 0.9985208,
      "best_epoch": 3
    },
    {
      "train_accuracy": 0.9898444444444444,
      "train_precision": 0.9896920957924201,
      "train_recall": 0.99,
      "train_f1": 0.9898460239518297,
      "train_auc": 0.9994631851851852,
      "train_loss": 0.027883790719509124,
      "train_lr": 9.05463412215599e-05,
      "val_accuracy": 0.9804,
      "val_precision": 0.9693239546697929,
      "val_recall": 0.9922,
      "val_f1": 0.9806285827238584,
      "val_auc": 0.99841906,
      "val_loss": 0.05912055150270462,
      "epoch": 4,
      "best_score": 0.9985208,
      "best_epoch": 3
    },
    {
      "train_accuracy": 0.9923333333333333,
      "train_precision": 0.9920927546532806,
      "train_recall": 0.9925777777777778,
      "train_f1": 0.9923352069494124,
      "train_auc": 0.9996829730864196,
      "train_loss": 0.02144948097599877,
      "train_lr": 8.362196501476348e-05,
      "val_accuracy": 0.9805,
      "val_precision": 0.9902060803917568,
      "val_recall": 0.9706,
      "val_f1": 0.9803050196949803,
      "val_auc": 0.9985545,
      "val_loss": 0.05964917826652527,
      "epoch": 5,
      "best_score": 0.9985545,
      "best_epoch": 5
    },
    {
      "train_accuracy": 0.9946777777777778,
      "train_precision": 0.9943372343496703,
      "train_recall": 0.9950222222222223,
      "train_f1": 0.9946796103564328,
      "train_auc": 0.9998543007407408,
      "train_loss": 0.014489709345499674,
      "train_lr": 7.525e-05,
      "val_accuracy": 0.9846,
      "val_precision": 0.9836327345309381,
      "val_recall": 0.9856,
      "val_f1": 0.9846153846153847,
      "val_auc": 0.9989584200000001,
      "val_loss": 0.04708186688423157,
      "epoch": 6,
      "best_score": 0.9989584200000001,
      "best_epoch": 6
    },
    {
      "train_accuracy": 0.9957111111111111,
      "train_precision": 0.9956230003554923,
      "train_recall": 0.9958,
      "train_f1": 0.9957114923117945,
      "train_auc": 0.9999142520987654,
      "train_loss": 0.011525133240222932,
      "train_lr": 6.57963412215599e-05,
      "val_accuracy": 0.9854,
      "val_precision": 0.9821215733015495,
      "val_recall": 0.9888,
      "val_f1": 0.9854494717958939,
      "val_auc": 0.99910214,
      "val_loss": 0.04492378194332123,
      "epoch": 7,
      "best_score": 0.99910214,
      "best_epoch": 7
    },
    {
      "train_accuracy": 0.9974222222222222,
      "train_precision": 0.997245423849298,
      "train_recall": 0.9976,
      "train_f1": 0.9974226804123711,
      "train_auc": 0.9999552076543209,
      "train_loss": 0.00758594262070126,
      "train_lr": 5.567415893174885e-05,
      "val_accuracy": 0.9841,
      "val_precision": 0.9851673682100621,
      "val_recall": 0.983,
      "val_f1": 0.9840824907398138,
      "val_auc": 0.99824604,
      "val_loss": 0.058025981426239014,
      "epoch": 8,
      "best_score": 0.99910214,
      "best_epoch": 7
    },
    {
      "train_accuracy": 0.9980444444444444,
      "train_precision": 0.9980665807369217,
      "train_recall": 0.9980222222222223,
      "train_f1": 0.9980444009866886,
      "train_auc": 0.9999777871604938,
      "train_loss": 0.005586612629890442,
      "train_lr": 4.532584106825116e-05,
      "val_accuracy": 0.983,
      "val_precision": 0.9906542056074766,
      "val_recall": 0.9752,
      "val_f1": 0.9828663575891957,
      "val_auc": 0.99864886,
      "val_loss": 0.06427293092012405,
      "epoch": 9,
      "best_score": 0.99910214,
      "best_epoch": 7
    },
    {
      "train_accuracy": 0.9987555555555555,
      "train_precision": 0.9988220651642441,
      "train_recall": 0.9986888888888888,
      "train_f1": 0.9987554725870613,
      "train_auc": 0.9999889651851852,
      "train_loss": 0.003702898653348287,
      "train_lr": 3.5203658778440106e-05,
      "val_accuracy": 0.9884,
      "val_precision": 0.9841395717684377,
      "val_recall": 0.9928,
      "val_f1": 0.9884508164078056,
      "val_auc": 0.99840138,
      "val_loss": 0.047817340672016144,
      "epoch": 10,
      "best_score": 0.99910214,
      "best_epoch": 7
    },
    {
      "train_accuracy": 0.9993555555555556,
      "train_precision": 0.9993555555555556,
      "train_recall": 0.9993555555555556,
      "train_f1": 0.9993555555555556,
      "train_auc": 0.9999965972839507,
      "train_loss": 0.001979789678255717,
      "train_lr": 2.5750000000000013e-05,
      "val_accuracy": 0.99,
      "val_precision": 0.9896083133493205,
      "val_recall": 0.9904,
      "val_f1": 0.9900039984006398,
      "val_auc": 0.9988039400000001,
      "val_loss": 0.048358546936511995,
      "epoch": 11,
      "best_score": 0.99910214,
      "best_epoch": 7
    },
    {
      "train_accuracy": 0.9998555555555556,
      "train_precision": 0.9998444479011578,
      "train_recall": 0.9998666666666667,
      "train_f1": 0.999855557160476,
      "train_auc": 0.9999994390123457,
      "train_loss": 0.0005382483495606316,
      "train_lr": 1.7378034985236535e-05,
      "val_accuracy": 0.9896,
      "val_precision": 0.9874551971326165,
      "val_recall": 0.9918,
      "val_f1": 0.9896228297744961,
      "val_auc": 0.9986725,
      "val_loss": 0.04577449473142624,
      "epoch": 12,
      "best_score": 0.99910214,
      "best_epoch": 7
    }
  ]
}

outputs/reports/openfake_baseline/summary.md

## 2) by_generator

- best auc:
  - grok-2-image-1212: 0.9992
  - sdxl-epic-realism: 0.9989
  - midjourney-6: 0.9985
  - gpt-image-1: 0.9984
  - ideogram-3.0: 0.9976
- worst auc:
  - sd-3.5: 0.9943
  - flux.1-dev: 0.9926
  - hidream-i1-full: 0.9918
  - imagen-4.0: 0.9899
  - flux-1.1-pro: 0.9834